{
  "schemaVersion": 2,
  "description": "A vault of crying obsidian under a stone lid — castle dungeons and a sanctum in a small dense world with no sky. The piglins sealed something in here; the crying obsidian is the lock, and it re-engages behind you. Whatever it is, it's still inside. The lock spreads. Crying obsidian creeps out through the frame and seals in whatever is beside it.",
  "seed": -7869444455040978050,
  "spawn": [64, -22, 192],
  "generator": {
    "type": "noise",
    "preset": "caves"
  },
  "biomes": [
    {
      "id": "incendium:weeping_valley",
      "climate": {
        "temperature": [-0.6, -0.3]
      }
    },
    {
      "id": "minecraft:crimson_forest",
      "climate": {
        "temperature": [-0.3, 0.0]
      }
    },
    {
      "id": "minecraft:basalt_deltas",
      "climate": {
        "temperature": [0.0, 0.3]
      }
    },
    {
      "id": "minecraft:soul_sand_valley",
      "climate": {
        "temperature": [0.3, 0.6]
      }
    },
    {
      "id": "incendium:withered_forest",
      "climate": {
        "temperature": [0.6, 0.9]
      }
    }
  ],
  "liquids": {
    "seaLevel": 20,
    "defaultFluid": "minecraft:lava"
  },
  "materials": {
    "defaultBlock": "minecraft:blackstone"
  },
  "dimensionType": {
    "hasCeiling": true
  },
  "atmosphere": {
    "fogColor": "#3B1B4B",
    "ambientLight": 0.06
  },
  "borders": {
    "player": 683,
    "generation": 1024
  },
  "difficulty": {
    "mobMultiplier": 2.2,
    "playerLuck": 2.0
  },
  "structures": {
    "density": "dense",
    "terrainAdaptation": {
      "incendium:forbidden_castle": "pedestal",
      "incendium:abandoned_tower": "pedestal"
    },
    "noise": {
      "endgame": "none"
    },
    "force": [
      {
        "structure": "incendium:forbidden_castle",
        "x": 0,
        "z": 0,
        "exclusive": false
      },
      {
        "structure": "incendium:sanctum",
        "x": -560,
        "z": 380
      }
    ],
    "radial": {
      "dungeons": [0.3, 0.5, 0.9, 1.3, 1.7, 2.0, 2.2, 2.2, 2.0, 1.7]
    },
    "wants": {
      "nether_dungeon": {
        "min": 0,
        "max": 102
      },
      "bastion": {
        "min": 68,
        "max": 512
      }
    }
  },
  "portals": [
    {
      "frameBlock": "minecraft:crying_obsidian",
      "igniterItem": "minecraft:flint_and_steel",
      "color": "6B3B8B",
      "lightLevel": 11,
      "scale": 12.0,
      "cooldown": 40,
      "shape": "door",
      "sounds": {
        "ignite": "block.portal.trigger",
        "enter": "block.portal.travel",
        "exit": "block.portal.travel"
      },
      "aura": {
        "subsume": "everything"
      },
      "singleUse": {
        "enabled": true,
        "delaySeconds": 12,
        "breakMode": "partial"
      }
    }
  ],
  "exitPortal": {
    "enabled": true,
    "pos": "spawn",
    "target": "bed"
  },
  "exitShrines": {
    "enabled": true,
    "target": "bed"
  },
  "roll": {
    "mood": "hard",
    "allowHazardousSpawn": true,
    "spawnFilter": [
      "incendium:weeping_valley",
      "minecraft:crimson_forest"
    ],
    "wants": {
      "forbidden_castle": "spread",
      "nether_dungeon": "near_spawn",
      "bastion": "spread",
      "infernal_altar": "spread",
      "nether_tower": "near_border"
    },
    "shuns": [
      "piglin_village",
      "crimson_fungus",
      "warped_outpost"
    ],
    "heightRange": [-40, 70]
  }
}
