{
  "schemaVersion": 2,
  "description": "Self-test fixture: structure density sparse on vanilla grids (noise off), for the density comparison.",
  "seed": 72,
  "spawn": [0, 64, 0],
  "generator": {
    "type": "noise",
    "preset": "overworld"
  },
  "borders": {
    "player": 1024
  },
  "structures": {"density": "sparse", "noise": false}
}
