{
  "schemaVersion": 2,
  "description": "Terrain gallery: islands, extreme setting.",
  "seed": 20261025,
  "spawn": [0, 64, 0],
  "generator": {
    "type": "noise",
    "preset": "overworld"
  },
  "terrain": {
    "base": "islands",
    "setting": "extreme"
  },
  "borders": {
    "player": 2048
  }
}
