{
  "schemaVersion": 2,
  "description": "Terrain gallery: terraces, gentle setting.",
  "seed": 20261025,
  "spawn": [0, 64, 0],
  "generator": {
    "type": "noise",
    "preset": "overworld"
  },
  "terrain": {
    "base": "terraces",
    "setting": "gentle"
  },
  "borders": {
    "player": 2048
  }
}
